TweetDate,TweetText
"2020-04-28 19:07:52+00:00","Vivy dont be stupid. Siapa beli duck dia bodoh" 
"2020-04-28 19:04:18+00:00","Vivy and Duck kembali trending " 
"2020-04-28 18:53:28+00:00","Aku tak tahu apa2 dari tadi n now baru tahu sbb kan group n ramai kecoh about duck scarves vivy yang tgah launch skrang ni " 
"2020-04-28 18:48:15+00:00","brapa kalilah vivy dengan duck ni nak kena cancel... renew lagi cancel lg renew lagi... lifetime subscription ke pe... haha" 
"2020-04-28 18:47:06+00:00","Tengah baca hal vivy duck apa semua ni" 
"2020-04-28 18:33:09+00:00","Vivy yusof buat hal lagi ke? Mujur lah aku tak pakai tudung duck." 
"2020-04-28 18:33:02+00:00","Orang bodoh je masih support duck n vivy dah 2020 pun masih support vivy..wtf... " 
"2020-04-28 18:24:07+00:00","you made a big fuss about duck scarves being copied but you copy too??? Lol shame on you vivy . Stop playing victim and go hire a new creative team" 
"2020-04-28 18:22:17+00:00","Lol @duck/vivy" 
"2020-07-25 08:16:00+00:00","Kami gembira kerana Calmer® menolong beberapa orang menghidap tinnitus mereka. https://www.flareaudio.com/pages/calmer-life" 
"2020-04-28 18:21:57+00:00","how is it possible vivy didn’t recognize the similarity of dUCk’s designs with the ones soonaru launched. I mean she even launched them on FV and for her to just go on w the Artsy collection 2 years later... is just mindblowing" 
"2020-04-28 18:19:55+00:00","Bosan siaa baca vivy lah duck apa semua penuh tl hmm kena mute ke cemana nii tapi nak tahu juga perkembangan semasa so hmm " 
"2020-04-28 18:18:00+00:00","Cian vivy hari hari terseDUCK disebabkan duck duck twitter." 
"2020-04-28 18:15:33+00:00","Cian vivy hari hari terseDUCK disebabkan duck duck twitter." 
"2020-04-28 18:15:10+00:00","me bukak twitter and found out vivy dUCK is trending " 
"2020-04-28 18:03:38+00:00","stressnya baca tea vivy tapi raya ni pakai duck tau sebab dah beli dulu tapi tak pakai lagiii " 
"2020-04-28 18:01:00+00:00","Tak pernah beli tudung duck sebab tak berkenan design and aku ni jenis suka kumpul banyak tudung so ofcourse cari yang tak mahal sangat. Berkenan beg je, sbb memang valuable dengan harga. I hope vivy boleh apologize to the other party. It's okay to be the first to admit.. " 
"2020-04-28 18:00:47+00:00","padia la vivy dgan duck dok trending ni" 
"2020-04-28 17:57:50+00:00","Vivy lagi, dUck lagi Apoooo." 
"2020-04-28 17:56:07+00:00","Period move on from duck and vivy yusof " 
"2020-04-28 17:55:57+00:00","It is time for us to let @JeffreeStar read dUCk and Vivy Yusof to filth" 
"2020-04-28 17:53:54+00:00","duck is always steals ppls designs vivy u duck duck " 
"2020-04-28 17:50:59+00:00","So ada dua cerita ke malam ni? 1. Again pasal vivy duck yusuf 2. Fake news pasal kematian Persoalannya, do ke minah yang mati dulu?" 
"2020-04-28 17:47:40+00:00","Pastu si vivy ni ada guts for making video about unboxing fake ducks.. when most of her products tiru underrated designer and people " 
"2020-04-28 17:41:32+00:00","Vivy should hire you and I. We are creative person and definitely dUCk gonna be awesome!" 
"2020-04-28 17:36:45+00:00","Ohhh. Rupanya di twitter timbul jgk vy itik. Igtkan di fb ja ada gelaran haiwan2 nie. #vivy #duck" 
"2020-04-28 17:36:00+00:00","vivy been copying many products since idk when, years ago but people still gonna buy it. why? because its Duck" 
"2020-04-28 17:32:22+00:00","Duck tiru design orang lain and Vivy dok marah2 kalau ada orang tiru duck dia..ei bapak kerek" 
"2020-04-28 17:31:48+00:00","I think she already explained clearly, sapa yang cari pasal lagi tu memang saja dengki tak mampu beli duck pastu panas bontot #Vivy " 
"2020-04-28 17:31:18+00:00","my twitter trends for me right now is "vivy"..... i've never bought her dUCK scarves is it that good??? nvm, I'm not buying it anyways, nevah" 
"2020-07-25 08:16:00+00:00","Kami gembira kerana Calmer® menolong beberapa orang menghidap tinnitus mereka. https://www.flareaudio.com/pages/calmer-life" 
"2020-04-28 17:30:19+00:00","Dah 2020 jenis vanggang je yg support duck dgn vivy." 
"2020-04-28 17:29:51+00:00","Vivy always be vavy... x paham why people bangga sangat dengan duck ni ... " 
"2020-04-28 17:28:21+00:00","All I can say is dUCk really need to work on their creative team, I tanak comment whether the design tu betul stolen or not, because I tak tau and I refuse to give any further statement regarding that. And the concept photos :’)) idk BUT srsly even if apa yang vivy claimed tu-" 
"2020-04-28 17:25:49+00:00","Aku ni memang tak berkenan pun vivy dengan dia punya duck tu haa. Tudung masjid jamek lagi cantik. Murah pun murah. Dah laa stealing hardwork orang, lepas tu play victim. Palatoe betul" 
"2020-04-28 17:24:28+00:00","Teringin betul aku nk tgk creative team duck si vivy ni . Siapa muka muka bertuah ni. Betul2 savage ! dah cedok idea orang claim diri designer . Hahahahahahaha" 
"2020-04-28 17:16:07+00:00","Dah kenapa pulak duck vivy ni alamak kejap la nak siapkan tutor baru jadi bawang" 
"2020-04-28 17:15:41+00:00","Bacoooo, pasal duck copycat design ore lain, bose sungguh la vivy ni xdok kijoan lain ko nk buat" 
"2020-04-28 17:15:20+00:00","What the fuck duck ? Hmm you are such a diligent person tau Vivy but then stealing other's idea , it is not diligent at all, respect her please @sleepylllama" 
"2020-04-28 17:08:25+00:00","Adehh naik balik dah vivy duck, next" 
"2020-04-28 17:06:50+00:00","Adeiii tiber nama Vivy Duck naik kat TL....dah tido lu ☻" 
"2020-04-28 17:05:02+00:00","Kalau Vivy Yusof melalui dUCk betul-betul nak bantu anak yatim dan tidak pergunakan sentimen anak yatim, aku cabar Vivy Yusof untuk sumbangkan 100% hasil jualan koleksi tudung tu instead of sebahagian sahaja. Kalau tak, dia hanya jadikan anak yatim as benteng utk kita fight dia. " 
"2020-04-28 17:05:01+00:00","Katanya platforms for locals to sell their products last2 design kene tiru. Not the first time Vivy. I unfollowed vivy and her brands and it gave me a piece of mind. VY is so cancelled #vivy #duck #fashionvalet" 
"2020-04-28 17:02:39+00:00","but why dUCk tho, other brands also using the same concept but yall not bashing it. Vivy has clarified it on her story" 
"2020-04-28 17:00:43+00:00","Okay gais. Betul ke duck tiru design tudung orang? Aku tak tau sangat. Aku tengok semua tudung sama je. Kalau betul aku nak maki vivy dan syarikat ni." 
"2020-04-28 16:59:38+00:00","Kah! At the end. My husband literally ask me to sell my duck. He said "saya anti vivy, pi jual tudung tu." 
"2020-04-28 16:59:28+00:00","Mari~ kita~ mute~ nama~ vivy~ duck~ dan nia~" 
"2020-04-28 16:59:09+00:00","Apo vivy .... tpi pleats dia best la x jmpe lgi pleats mcm duck huhuhu" 
"2020-04-28 16:59:05+00:00","disgusting. vivy, you're so disgusting by saying things that you did AND KEEP ON DOING IT. the audacity u have to say that people are accusing u and your brand?? ahjumma i think you should release a new product lah, the dUCk MIRROR " 
"2020-04-28 16:53:51+00:00","Aq rasa kalo nak sgt design cam tu cuba buat jv antara duck dgn jenama sis tu.(sorry i lupa jenama yg ori design tu) nie mengaku kau punya. Tau x duit tu kau bagi anak kau mkn pikir halal ke sis vivy oi. Tau dulu marah org curi idea kau. U should know ttg kifarah. " 
"2020-04-28 16:53:23+00:00","So vivy and her ducks become trending again?" 
"2020-07-25 08:16:00+00:00","Kami gembira kerana Calmer® menolong beberapa orang menghidap tinnitus mereka. https://www.flareaudio.com/pages/calmer-life" 
"2020-04-28 16:52:44+00:00","Just because duck is one of the famous brand doesn't mean that they can do something illegal to other people. When you said that hired the new team, I pretty agree with you. To Vivy, don't do something good using bad way. Yes people gonna be silent after this but not forget " 
"2020-04-28 16:51:21+00:00","Another month, another Vivy and duck drama. As some twitterian said in the last drama "its like she has a kpi to maintain, so she has to create a drama every other month". I should start muting those two words. Rakyat marhaen like me isn't her target market anyway." 
"2020-04-28 16:49:48+00:00","Duck scarves by Vivy will torn this time" 
"2020-04-28 16:47:39+00:00","Vivy trending? As expected. Company besar designer ramai gaji mahai pun still nak plagiarise ke? Duck off" 
"2020-04-28 16:47:31+00:00","Here again vivy and dUCk" 
"2020-04-28 16:46:35+00:00","tak beli tudung raya lagi sebab rasa macam tak raya. tapi the only one yang match dengan tudung ialah duck 2016. tapi takmau bekas orang &amp; taknak kena kecam beli product vivy " 
"2020-04-28 16:45:12+00:00","and yeah i guess its her team fault for not fact-checking this idea in the very first place. but no matter what, vivy is the face of dUck, thats why if any other issue resurfaces after this, including this one, she will be the one getting the most backlash.." 
"2020-04-28 16:42:31+00:00","Vivy is at it again guys hahahahah whats wrong with dUCk yo" 
"2020-04-28 16:40:33+00:00","Oh i see. Patutlah vivy trending lagi Never end issues. Dah colab dengan FV pastu tiru idea whats wrong with duck teamm." 
"2020-04-28 16:40:15+00:00","vivy dan duck jadi trending lagi sekali hahahaha mantappp" 
"2020-04-28 16:39:53+00:00","so, again vivy and duck on trending?" 
"2020-04-28 16:37:18+00:00","idk why but i think later will appear dUCK collab with Nia. haha. but since she is vivy so i think this will not happen." 
"2020-04-28 16:37:06+00:00","If i say i don’t see any similarity on the designs would i be accused of being vivy army? maybe the concept of the shoot is exactly the same or should i say nearly....kalau brand lain buat trust me its not a big thing pun ni sebab duck je tahu dh " 
"2020-04-28 16:36:16+00:00","Vivy Duck can change to Dick already" 
"2020-04-28 16:34:10+00:00","what the hell happened vivy??? such ignorant la this rich people........ am not gonna buy duck again no moreeeeeeee." 
"2020-04-28 16:34:07+00:00","Patutlah aku blur pasal kes duck. Sebab da muted words for vivy and ducks. So tweet semua cam sekerat2 je " 
"2020-04-28 16:32:37+00:00","Vivy and Duck design boleh gi mam, bapak tak creative" 
"2020-04-28 16:29:50+00:00","Vivy: "Many have done this concept but as usual, if dUCk does it, let's boycott dUCK" But the thing here is Vivy, ever since Nia launched her collab product, I have not seen any single brand/product that did the same concept. And today, by "coincidence".." 
"2020-04-28 16:28:32+00:00","sumpah kalau aku tengok perempuan pakai tudung duck memang aku turn off!!! . why?! sebab kau support vivy thats why!!" 
"2020-04-28 16:24:51+00:00","I dah tak beli duck lama gila bye vivy!" 
"2020-07-25 08:16:00+00:00","Kami gembira kerana Calmer® menolong beberapa orang menghidap tinnitus mereka. https://www.flareaudio.com/pages/calmer-life" 
"2020-04-28 16:22:56+00:00","Ready duck supporter comments on ig... You guys are seriously blinded. Tah apa lah dapat backup vivy tu. Dia makin kaya. Korang tak dapat apa pun lolz" 
"2020-04-28 16:22:04+00:00","Duck duck vivy " 
"2020-04-28 16:20:19+00:00","lol same tak minat duck plus tak minat vivy yusof because of her “superior” attitude " 
"2020-04-28 16:19:58+00:00","stop supporting vivy’s company fashion valet and her brand dUck !!!" 
"2020-04-28 16:16:22+00:00","Argh tak habis-habis kes si Vivy baik aku main candy crush (adakah CC keluaran duck ?) kalau betul aku boikot CC !" 
"2020-04-28 16:15:43+00:00","Can Vivy just apologize and deal with this professionally ? Omg she still goes around bragging and posting about people buying her so called Artsy duck when her ‘team’ clearly stole that idea from someone else. How ignorant and oblivious. A joke" 
"2020-04-28 16:14:03+00:00","Duck being duck and Vivy being Vivy once again.... How on earth you still act innocent when you already being accused for countless time? Please hire new designers duck." 
"2020-04-28 16:13:20+00:00","so vivy plagiarized nia's idea on the latest duck scarf campaign?" 
"2020-04-28 16:13:16+00:00","so vivy curi design orang but ramai je lagi support duck product idk why dorang kena santau ke nyah." 
"2020-04-28 16:10:46+00:00","xkn orang T20 copy paste idea orang? . kesian usaha orang lain. tup tup copy idea orang untuk brand duck dia sendiri. vivy oh vivy tak pernah belajar dari kesilapan lepas.. ke sebenarnya saja copy idea org untuk viral diri sendiri dan produk sendiri? " 
"2020-04-28 16:06:04+00:00","Apa benda yg vivy and her duck teams buat ni? The only printed design yg i rasa i suka is the merdeka duck last year. Yg lain buruk. I stay with the plain one itu pon if ada warna yg sesuai utk dark skin tone." 
"2020-04-28 16:05:59+00:00","VIVY AGAIN? BOYCOTT JELA BELI DUCK PUNYA PRODUCT. SUPPORT BISNES DIA LAGI BUAT APA. BANYAK LAGI USAHAWAN YG LEBIH LAYAK UTK KORANG SUPPORT. COME ON MALAYSIA. U CAN DO THIS. " 
"2020-04-28 16:05:39+00:00","Buat masalah besar mana pun, si vivy ni mesti play victim. Tak faham knp org masih support duck dia ni" 
"2020-04-28 16:02:32+00:00","Lol boleh tak vivyduck ni cetus isu tahun lain? Orang dah penat ah dgn corona ni." 
"2020-04-28 16:02:31+00:00","Iols pun dari dulu tak sapot duck &amp; vivy ni. Maklumlah duit pun takde" 
"2020-04-28 16:00:46+00:00","omg vivy omg duck" 
"2020-04-28 15:56:35+00:00","Duck or fv or vivy or so whatever they called, dah lama cancelled sebenarnya. Idk why people still backup her?? It happens too may times already " 
"2020-04-28 15:55:20+00:00","Im never supporting duck. And vivy. Honestly." 
"2020-04-28 15:50:23+00:00","Creative team kat duck group tak buat research ke before design tudung itik kau tu? Vivy pun takkan la tak aware padahal tudung yang dia tiru tu launch kat fashion valet kot. Lol" 
"2020-04-28 15:49:23+00:00","vivy and duck again lol. quack quack" 
"2020-07-25 08:16:00+00:00","Kami gembira kerana Calmer® menolong beberapa orang menghidap tinnitus mereka. https://www.flareaudio.com/pages/calmer-life" 
"2020-04-28 15:47:10+00:00","Vivy x duck trending again" 
"2020-04-28 15:46:57+00:00","belum checkout . selamat lgi . tak agongkan vivy or duck . tp klu design lawa why not kahkah #jangankecamsis" 
"2020-04-28 15:43:48+00:00","Bosan la cerita pasal vivy yusuf and duck blah blah blah.. next .." 
"2020-04-28 15:37:38+00:00","Sebebarnya banyak je design tudung macam design dUck yang baru ni. Belambak kat shutterstock. Tapi tu lah, kalau sampai vivy buat je semua jadi salah. Smh" 
"2020-04-28 15:37:15+00:00","Vivy trending malam ni due to new launching of The Artsy Duck yang dikatakan imitate other designer. Hikmah PKP &amp; Ramadhan kali ini menyedarkan saya yang luxuries won’t fill stomach. " 
"2020-04-28 15:36:57+00:00","All these things about Vivy and her Duck, when the trending season is over, people would still buy her products lulz." 
"2020-04-28 15:36:05+00:00","Vivy is canceled Duck is canceled" 
"2020-04-28 15:35:44+00:00","Bukan duckies ke? Rasanya vivy penah panggil duck collector with a name tp not duck army" 
"2020-04-28 15:34:50+00:00","Kembali lagi dalam episode, Vivy and The Duck Group knk viral. What’s new " 
"2020-04-28 15:33:37+00:00","Entah! Lepas kes tu korg elok je puja vivy balik . Kammon gais duck group dh banyak copy karya org lain. Mentang2 dia plg besar kita yg bawah bawah ni takkan asik kena tindas je " 
"2020-04-28 15:33:15+00:00","Vivy ni ciplak design sebab dUCk ada target market yang suka tudung design ciplak. " 
"2020-04-28 15:28:25+00:00","Before ni malas ambik tau pasal vivy sebab duit aku sesen dia tak penah rasa. so i had no problem.but tonight punya issue just little too much.asyik play victim pastu kaut duit byk2 dgn guna nama for charity.Wahai wanita malaysia yang stand for duck stop la jangan jadi buta bodoh" 
"2020-04-28 15:23:44+00:00","I think 6 to 7 years ago, everyone in my circle spoke highly of dUck, and Vivy of course. How did she manage to get herself and the brand into these kinds of mess?" 
"2020-04-28 15:18:30+00:00","wow duck wow vivy https://twitter.com/annisah_k/status/1255100234469793792" 
"2020-04-28 15:16:14+00:00","hang setakat beli lipstick duck tu takyah lah defend sangat kak vivy hang tu" 
"2020-04-28 15:15:45+00:00","Takda la kenal sgt & ambik kisah sgt psl isu2 Vivy &amp; dUck ni, tp kdg2 mcm lawak tengok org dok tuduh dia tiru design. Entahlah maybe dia tiru betul, tp industri design2 di Malaysia ni kecik ja. Pusing pi pusing mai mmg akan lebih kurang ja rasanya.." 
"2020-04-28 15:10:03+00:00","Vivy has explained yg duck tak tiru mana mana brand. Sesungguhnya saya bukan fan duck or vivy tapi saya rasa saya perlu share. Okbye. " 
"2020-04-28 15:09:56+00:00","Korang kecam laa vivy and duck. Takde maknanya dia bankrupt sebab dia pun rugi 10M lekkk jee" 
"2020-04-28 15:09:24+00:00","Adoi Vivy buat ape plak kali ni??!! Semak lah lalu kat TL aku. Tak habis2 buat perangai Kita ada isu lebih penting yaaa daripada DUCK or FASHION VALET tu yaaa" 
"2020-04-28 15:09:15+00:00","Boikot jela duck noncen. Entah pape entah #Vivy" 
"2020-07-25 08:16:00+00:00","Kami gembira kerana Calmer® menolong beberapa orang menghidap tinnitus mereka. https://www.flareaudio.com/pages/calmer-life" 
"2020-04-28 15:09:11+00:00","If yall bought or support vivy yusof/duck after they steal sleepylllama’s artwork, yall can unfollow or block me now" 
"2020-04-28 15:08:05+00:00","org yg still support vivy and duCk ni, korang still tak sedar lagi ke???!!!" 
"2020-04-28 15:05:41+00:00","Bila duck tiru design orang Ctrl C + Ctrl Vivy" 
"2020-04-28 15:05:29+00:00","plagiarism. this is not their first time. lol idk what to say anymore towards vivy and her duck team" 
"2020-04-28 15:02:25+00:00","Aigooo.. Vivy.. What again.. Dah berapa kali trending during PKP ni . I was not surprised at her latest copycat issue. Duck brand will keep on doing it. She doesn't care, at all. Bukan 1st time kan. Haip! Biasa dia niii..... " 
"2020-04-28 14:58:12+00:00","vivy kat vlog fake duck scarves kemain ew and downgradekan scarves tu sekarang? plagiat design orang, sama je nyah" 
"2020-04-28 14:52:08+00:00","Vivy did it again ! Enough is enough no more duck purchase" 
"2020-04-28 14:51:13+00:00","Vivy Yusof and DUck is cancelled !" 
"2020-04-28 14:50:53+00:00","Duck itu duck ini. Vivy itu vivy ini. Time sale kemain semua laju kalah anak itik tok wi pi website FV untuk beli barang. " 
"2020-04-28 14:49:22+00:00","vivy and her duck scarves is forever cancelled" 
"2020-04-28 14:45:23+00:00","vivy copied sleepylllama’s design from sonaru for the new duck collection &amp; is now saying “im so sad keep getting accused” girl whaaaaat? pls tell her what she doing aint cute " 
"2020-04-28 14:44:47+00:00","Dia sebenarnya isu plagiat ni orang takde nak buat teruk sangat kalau Vivy tak acah nak jijikkan fake duck. "Omg how could you sembahyang in this fake telekung??" and then there you go vy." 
"2020-04-28 14:40:55+00:00","Me after looking at Nia Atasha and Vivy Yusof Instagram account: What is Duck again? Dude really need a new creative team :(" 
"2020-04-28 14:39:43+00:00","I have nothing against vivy yusof or duck tapi kelakar la dodolllllllllllll adoi" 
"2020-04-28 14:31:54+00:00","revamp or tweak the whole photoshoot concept and prints but nope, here we are. The reason I said that is because, SoonaruxSleepystudio was and still being sold under FV. As we all know, FV is connected to Vivy &amp; dUCk &amp; sum all the facts above, that doesn't sound ethical at all." 
"2020-04-28 14:30:02+00:00","im really devasted for Nia, i know her personally since studies day knowing her personality i just hope this time she let her anger take over and crush the shameless Duck and Vivy, im beyond disgusted how low can they get " 
"2020-04-28 14:27:47+00:00","I’m not trying to add fuel to the flames, and I am aware that Vivy is going through a lot with recent issues. I do believe that this is Duck’s team that’s causing the problem. But it is what it is I hope nobody gets fired." 
"2020-04-28 14:27:38+00:00","done unfollow vivy, siapa berminat dengan duck saya leh pm tepi saya jual mur mur" 
"2020-04-28 14:24:45+00:00","Haritu bukak ig, duck product and vivy ada kat timeline. Lupa nak unfollow. " 
"2020-04-28 14:24:25+00:00","Fv app mesti akn tk function jugk bila duck launch yg bru even ramai mana pun haters vivy " 
"2020-07-25 08:16:00+00:00","Kami gembira kerana Calmer® menolong beberapa orang menghidap tinnitus mereka. https://www.flareaudio.com/pages/calmer-life" 
"2020-04-28 14:21:17+00:00","Vivy goes viral again yang penting @vivyyusof sold out duck tu" 
"2020-04-28 14:17:46+00:00","Aku lagi tak pelik ramai yang bodoh masih support duck n vivy. Ah sudah lah... " 
"2020-04-28 13:51:30+00:00","Duck curi design @sleepylllama ..vivy did it again" 
"2020-04-28 13:42:52+00:00","Vivy and duck will be trending soon..." 
"2020-04-28 13:42:33+00:00","guess the duck company needs to hire a team, so not cool vivy yusof. please stop embrassing youself. " 
"2020-04-28 13:42:06+00:00","are you talking about vivy and duck?" 
"2020-04-28 13:16:17+00:00","Weh kau tengok tak video duck post??? Geram je aku tengok vivy gelak gelak tu" 
"2020-04-28 13:15:33+00:00","Shaming Vivy won't work because she can dry her tears with money. Rich people still buy her stuff. But shaming &amp; villfying duck customers &amp; wearers.. emphasizing the narrative that they support plagiarism and exploitation of others. I think that would hurt the brand." 
"2020-04-28 13:11:13+00:00","Dah. Dari dulu memang tak berkenan dgn FV / Duck brand. Not a drop of originality in the brand. Good job vivy yusof for taking other people's hard work and make profit out of it. Semua benda kau tiru sebab nak kaya. This collection was my friend's baby. " 
"2020-04-28 13:09:58+00:00","vivy yusof ni dulu kemain buat review fake ducks astu acah geli geli ew sana ew sini sebab orang guna design dia, ni apa cite ni haih angek pulak den donga https://twitter.com/annisah_k/status/1255100234469793792" 
"2020-04-28 13:05:38+00:00","i hate duck, and vivy, and those who support them" 
"2020-04-28 13:05:24+00:00","Mgkin vivy terjumpa design tu dlm internet and seller tu jenis yg xfemes lg tp tdg dia jual murah , so dia copy design sama and jual pd hrga "standard duck" . Bila org tgk pattern sama , org akn ckp the original designer ni copyori vivy punya sbb dia jual lg murah" 
"2020-04-28 12:55:42+00:00","One after another eh vivy. We love your duck dont do this to us :(" 
"2020-04-28 12:54:19+00:00","Duck released a new tudung yang rip off concept and art from this local artist. Search je vivy usop kat twitter hahha" 
"2020-04-28 12:53:25+00:00","Yang selebriti selalu kena copycat dgn duck, mesti tak pernah dapat giveaway dari vivy en" 
"2020-04-28 12:48:13+00:00","Vivy ni memang every campaign of duck ( scarves/cosmetics ) memang dia je ke on screen?.....i mean , hmm tak apa lah " 
"2020-04-28 12:36:49+00:00","shame on you vivy yusof &amp; the duck group for copywriting @sleepylllama's design." 
"2020-04-28 12:20:21+00:00","TOLD VIVY WRITE DUCK ON MY DUCK" 
"2020-04-28 12:18:22+00:00","i know ramai dah cancel vivy i dont support her and i dont hate her too BUT NOW i just i wanna say it out loud that VIVY IS CANCELLED DUCK IS CANCELLED" 
"2020-07-25 08:16:00+00:00","Kami gembira kerana Calmer® menolong beberapa orang menghidap tinnitus mereka. https://www.flareaudio.com/pages/calmer-life" 
"2020-04-28 12:17:20+00:00","Vivy/duck curi idea siapa?" 
"2020-04-28 12:10:57+00:00","Vivy/dUck copying other people’s designs? what’s new with that? they lack originality &amp; they’re known for stealing ideas. i feel bad for @sleepylllama :(" 
"2020-04-28 12:10:40+00:00","vivy ni dah lama cancel since issue plagiarism. Orang copy duck tau pula marah" 
"2020-04-28 11:52:16+00:00","duck copying nia’s art collaboration with soonaru. stop la vivy stop. you way too much haih " 
"2020-04-27 13:00:03+00:00","Ohyeke, then straight foward weh beli tudung duck, kesian vivy. Agaknya dah berbuka ke belum tu" 
"2020-04-27 03:08:28+00:00","Muka dia memang mcm vivydUck " 
"2020-04-25 18:00:27+00:00","For now, baru rasa sakitnya vivy bila nampak banyak fake duck kat pasaran. Kita penat penat kerja bagi naik brand, buat itu ini. Depa sekelip mata je leh copy tanpa segan silu" 
"2020-04-25 08:35:54+00:00","kalau ada partner dah lama aku hadiahkan dia vivy duck hehe" 
"2020-04-24 12:32:10+00:00","So this year, I’m not gonna support FV and Duck. Sorry, Vivy " 
"2020-04-24 11:08:00+00:00","I banned duck &amp; vivy tapi i takboleh banned pleats duckscarves sebab sooo cantik " 
"2020-04-24 06:31:17+00:00","geng geng duck vivy niee" 
"2020-04-23 22:46:19+00:00","Did vivy used her crowdfunded money to buy duck wtf " 
"2020-04-23 04:51:34+00:00","Nak derma tak perlu mention harga, org lain pun ramai derma tapi tak mention harga pun. Kalau tak nak kena kecam tajuk vivy yusof derma kan tudung duck untuk frontliner. Dah show off harga tak pasal kena kecam lagi dan lagi.." 
"2020-04-23 03:52:50+00:00","kualiti duck vietnam dengan vivy sama je. beza harga je yahudi yang vivy jual " 
"2020-04-23 01:59:03+00:00","Last few weeks people be boycotting vivy and duck but also last night phew sold out after 10 mins " 
"2020-04-23 01:51:27+00:00","Ada tweet tu pasal vivy. Diorang ckp vivy guna duit yg derma tu untuk beli tudung dia. Padahal haritu aku baca vivy bgtau tu sumbangan dari duck sendiri. Takde guna duit dari derma org pun. Kadang geram sbb over benor ckp pasal org." 
"2020-04-23 01:49:09+00:00","RM255,000 untuk 1700 tudung??? 255,000÷1700 = RM150/pcs Kejap, kejap.. ada sticker duck ke kat tudung tu?? Sorry but u still cancel vivy " 
"2020-04-23 01:38:07+00:00","Fluff duck vivy hadiah ni kain dia mcm kain serban lelaki nipis tu. " 
"2020-04-22 16:08:05+00:00","lepas unfollow vivy &amp; duck. dompet saya boleh bernafas " 
