TweetDate,TweetText
"2020-03-29 07:26:35+00:00","Tak pernah ada rasa pun nak support vivy ni. Dari dulu lagi la kluarkan statement tak pakai otak. Aku tak paham org yang masih support dia??!? Jangan sampai aku beli duck vietnam! " 
"2020-03-29 07:26:30+00:00","Ok why vivy and duck is trending on twitter? Time to dig " 
"2020-03-29 07:22:56+00:00","Everytime vivy yusof viral hangpa kata jangan beli duck. Habis ja issue tu. Hangpa duk berpusu beli duck. Manusia mudah memaafkan kan?" 
"2020-03-29 07:22:21+00:00","Vivy Yusof's reputation is tarnished. Hopefully she can fix it with "duck"-tape." 
"2020-03-29 07:21:07+00:00","Guys,remember even duck tengah ada sales sekarang,kita jangan beli because we will make vivy more arrogant.Let’s boycott her cheap quality satin scarf." 
"2020-03-29 07:19:13+00:00","Tp tak salah pn beli sbb suka. Plus boleh jual balik k segala duck tu, ada harga worth it la. &amp; vivy pun ok jgk as role model cuma certain issue mcm ni, ntahla. Sis just mmg tak berapa mengidolakan so takla kisah sgt. Cuma mcm men down grade kan others tu mcm kurang adab. Kennn" 
"2020-03-29 07:17:46+00:00","wanted to buy ducks shawl for so many times but whenever i wanna buy it, mesti vivy buat hal lol. ended up i tak beli sebab the boss herself. haih ada hikmah, maleh aque baik aku beli tudung member guzel.kl, korang gi beli dkt dia, cheaper tp quality " 
"2020-03-29 07:16:59+00:00","Vivy punya pasal habis siapa pakai dUCk lepasni kena kecam. Dah aku nak jual semua dUCk siapa nak pm tepi " 
"2020-03-29 07:16:43+00:00","i beli sekali tudung duck, pendek sangat, mudah tertarik benang dah rosak part printed tu, susah nak bentuk, mel molly shoes pulak baru pakai 3 hari dah tercabut top piece, sampah je produk vivy yusof ni" 
"2020-03-29 07:16:17+00:00","Aku dah lama cancelled Vivy Yusof sebab aku mana mampu beli barang duck. Haha tapi dia memang banyak issue pun - Downgrade pregnant womens yang selalu ada morning sickness. - Ciplak turban design Ilham Chenta - Issue fake telekung - now issue takde empathy towards B40. " 
"2020-07-25 08:16:00+00:00","Kami gembira kerana Calmer® menolong beberapa orang menghidap tinnitus mereka. https://www.flareaudio.com/pages/calmer-life" 
"2020-03-29 07:15:50+00:00","Time to unfollow vivy guys. Kalau korang masih sibuk nak beli duck dia tu aku tak tau la nak buat apa." 
"2020-03-29 07:13:21+00:00","Netizens: Vivy is cancelled Vivy: We’re releasing a new duck Netizens: " 
"2020-03-29 07:11:53+00:00","Korang dok kutuk2 vivy tu nanti raya mencari juge duck tu." 
"2020-03-29 07:10:18+00:00","Mcm2 dia jual. Tudung, beg etc Vivy yusof owner the duck/fashion valet" 
"2020-03-29 07:09:40+00:00","Vivy Yusof jual dUCk Aleeya Zailan jual bABi ek?" 
"2020-03-29 07:03:56+00:00","dUCk is trending bcoz of vivy yusof. wowww" 
"2020-03-29 06:57:36+00:00","Korang ni tak faham2 lagi ke pasal isu Vivy ni. Dah dapat 1800 nanti korang beli la produk dUck dia banyak2. Takkan tu pun nak kena ajar. Support la produk local. Itu je yang dipinta" 
"2020-03-29 06:54:47+00:00","sial la vivy tudung itik ni dari dulu perangai macam bodoh. fuck, korang kalau support tudung duck tu jangan kawan dgn aku lah. all of you are fucking retards to support douches like her." 
"2020-03-29 06:48:55+00:00","Aku memang dari dulu menyampah dgn Vivy Yusof duck ni!" 
"2020-03-29 06:48:11+00:00","Baru ingat nak beli dUck for raya. Vivy is cancelled " 
"2020-03-29 06:48:11+00:00","Beli tudung Duck tak semestinya suka Vivy" 
"2020-03-29 06:47:33+00:00","sebagai suami yang selalu beli tudung Duck untuk isteri, harap Fahmi basuh isteri mengenai perangai Vivy ni ahahahhahaa" 
"2020-03-29 06:47:22+00:00","Haritu macam nak beli lipstick dUCk tapi tak jadi lah lepas vivy comment camtu huhuhu" 
"2020-03-29 06:47:03+00:00","sampah vivy. fashion valet harap duit investor.untung xde. harap " duck" boikottt" 
"2020-03-29 06:47:00+00:00","Vivy Yusof dah laaaa sekali keluarkan tudung duck cepat jeee sold out, artis semua beli bukan sehelai 2, mostly borong semua warna, kat situ jeee dah dapat berapa income, belum masuk makeup apa lagi hm" 
"2020-03-29 06:42:49+00:00","vivy anju duck" 
"2020-03-29 06:42:35+00:00","Yang tahu vivy yusof tu product dia duck &amp; fashion valet. Yang satu lagi tu tak kenal" 
"2020-03-29 06:37:54+00:00","Aku x kenal sorang tu but aku pernah beli produk vivy ni nk bg kakak aku , product sampah , siapa yg beli duck ni , mmg idiot , cost buat dia sgt murah and dia jual mahal nk mampos , aku pun salah sorang idiot but lesson learnt #saynotovivyyusof" 
"2020-03-29 06:36:12+00:00","Vivy sepatutnya letak logo duck pada botol hand sanitizer. barulah boleh buat jualan masa PKP ni. Itu pun nak ajar ke. " 
"2020-03-29 06:31:46+00:00","Kahkahkah. Intannnnn. Tengok laki mu ni. Tp serius aku pun dah stop beli mende2 duck ke, fashionvalet ke. Since reveal kes khazanah vivy dulu tu." 
"2020-07-25 08:16:00+00:00","Kami gembira kerana Calmer® menolong beberapa orang menghidap tinnitus mereka. https://www.flareaudio.com/pages/calmer-life" 
"2020-03-29 06:29:48+00:00","anju duck vivy" 
"2020-03-29 06:27:40+00:00","I used to like vivy. Now i wonder if duck is still relevant with my money " 
"2020-03-29 06:24:30+00:00","betul ah tu jsksksks vivy tu kilang dia from vietnam je pun hhaahaha kalau reject stocks boleh dapat murah murah kat vietnam tudung duck tu hahah sebab vietnam &amp; indonesia cam fabric kuat kan huhu i pun ni telekung beli from pergi bandung dulu convert duit malaysia baru 20" 
"2020-03-29 06:23:51+00:00","Bila bisnes jatuh siapa bayar kerugian ? Pekerja atau investor/busines owner? So bila bercakap biar kena pada fakta. Pekerja hanya hilang kerja dan pergi cari kerja lain. Investor/owner tanggung segala kerugian. #vivy #duck #entrepreneur" 
"2020-03-29 06:13:58+00:00","Stop la nak agungkan product si vivy yusop tu. best sgt ke pakai duck scarf dia tu. tak penah teringin pon nak beli and pakai. " 
"2020-03-29 06:11:24+00:00","Dah la korang dan benci, maki si vivy tu nanti kau beli jugak duck dia." 
"2020-03-29 06:05:38+00:00","Aku tak pernah follow pun vivy. Dia jual duck tu kan? Aah harga macam nak mampos. Kualiti sama je pun" 
"2020-03-29 06:02:49+00:00","Korang ni acah je vivy is cancelled bagai after this beli jugak duck scarves lolz" 
"2020-03-29 05:59:09+00:00","Paling benci Vivy! No wonder aku tak pernah suka dia or orang yang sokong dia! Harap yang pakai Duck masuk sorga " 
"2020-03-29 05:58:37+00:00","Hahaha. Tun kalah dgn vivy ke dgn duck? Kalau dgn duck so jgn fikir psl owner dia. So boleh kutuk owner dia. Hahaha. Suruh vivy makan dlm pampers lg laaaa sebulan dua ni." 
"2020-03-29 05:58:33+00:00","Vivy = tudung duck Zailan = anyone?" 
"2020-03-29 05:56:21+00:00","Vivy duck ni risau sangat tak dpt bayar gaji pekerja kenapa ye?tak bayar kwsp pekerja ke?boleh kan bincang kat ws group utk gaji pekerja dgn pekerja utk minta pertimbangan. Monthly kereta dgn office kan boleh tangguh 6 bulan." 
"2020-03-29 05:55:19+00:00","Well i never like vivy and duck whatever since i know her hahah. She just look fake to me opss sorry vivy fans lol " 
"2020-03-29 05:55:02+00:00","Unfollow Vivy Yusof, Duck &amp; FV" 
"2020-03-29 05:50:08+00:00","Vivy yusof is cancelled. No more duck or fv. Kaya mewah tapi sayang BODOH rupanyaaa. Tolong respect org yang kurang berkemampuan. Malah menghina &amp; cakap mcm2 pulak. #vivyyusof" 
"2020-03-29 05:44:12+00:00","alaaa.. sok marah mara kat vivy.. cuba duck buat sale.. beraturrr jugakk.. kejap je sold out.. alasan.. murah dr biasa.. ahh.. sudah la korang.. iols malas layan.. iols beli tudung pasar malam je. xpon beli kat muaz textile. murahh." 
"2020-03-29 05:37:28+00:00","Aku jadi tertanya tanya. Dalam diaorang sibuk duk perli golongan B40 ni, ada ke golongan B40 yang jadi customers diaorang? Sebab kat timeline aku, ramai jugak students uni yang suka beli tudung duck si vivy ni. Maybe diaorang kaya kot." 
"2020-03-29 05:29:11+00:00","so vivy ada issue lagi. kontroversi dengan vivy berpisah tiada. setakat ni, tudung duck yg paling selesa ade pleats. yg lain design je lawa. hehehehe" 
"2020-03-29 05:28:29+00:00","Vivy Yusof does not care about poor people. Stop buying DUCK SCARVES and other products from these spoiled, rich brats who have no sympathy and empathy for the plight of the poor. #VivyYusof #COVID-19" 
"2020-03-29 05:24:12+00:00","Hmm, i love duck. But why vivy. Whyyy." 
"2020-07-25 08:16:00+00:00","Kami gembira kerana Calmer® menolong beberapa orang menghidap tinnitus mereka. https://www.flareaudio.com/pages/calmer-life" 
"2020-03-29 05:23:46+00:00","Quite a bargain jugak right now, beli tudung dUck, bukan dpt tudung je, dapat free penghinaan daripada Vivy Yusof sekali." 
"2020-03-29 05:18:56+00:00","Bukan main belagak lagi vivy ni ek. Aku nak balar tudung duck yeem utk melepas geram." 
"2020-03-29 05:13:48+00:00","aku menyampah dengan vivy ni sejak dia buat muka disgust dengan product murah2 . hina sangat kot orang pakai brand murah .. mmg start dari tu tak beli duck dah" 
"2020-03-29 05:08:47+00:00","Sapa lah mengidolakan vivy tu. Tp tu lah sedap pula tudung duck dia." 
"2020-03-29 05:08:43+00:00","Dorg dlm business, mst pikir rugi juga and ade back up plan. Takkan xde suma tu. pelik gilaa nampak sgt vivy ni xde backup plan . Good luck la sape keje dgn fv and duck" 
"2020-03-29 05:06:59+00:00","Alaah tapi vivy ni mmg favourite netizen untuk kecam.. dia tercakap salah sikit je mmg satu malaysia akan kecam i rasa org dendam ngn dia sbb capitalism so dorg akan attack any chance they get but then raya nnti beli jugak duck " 
"2020-03-29 04:53:33+00:00","Lama dah vivy aku start nk cancelled. Hihi. Sedih sbb dulu pakai shawl elok je sekarang. Aku pun bukan baik nau. Takpe lar stop beli DuCK kuwekk kuweekkk " 
"2020-03-29 04:33:28+00:00","Vivy, I love your tudung but I hate your attitude that makes me want to hate your tudung. From today onwards I will not buy any duck scarves anymore" 
"2020-03-29 04:18:38+00:00","looking at vivy yusof’s lifestyle in the internet makes me stop buying from dUCK. ever again. she have her good points but, sometimes she lacks of empathy because of her background." 
"2020-03-28 16:22:34+00:00","Vivy Yusof is cancel. Good Bye Duck. I’ve been supporting you for the longest ever since you produce Bamboo material ke apa entah tu. Now, I feel so guilty towards your staff when you’re coming up w that kind of statement. Kesiannya." 
"2020-03-26 14:46:14+00:00","why duck is trending in Malaysia did vIVY ucop did something" 
"2020-03-26 13:25:15+00:00","Tu duck vivy ahaha kan?ni duck jepun " 
"2020-03-26 06:23:51+00:00","I know a few people who talk shit about Vivy and Fadza and also the ones who bought many dUCk’s products. Awak tambah dosa, depa tambah duit " 
"2020-03-24 04:32:21+00:00","Scrolling vivy's previous post on instagram only to see how she style her tudung cause only she can rock the duck scarves so well " 
"2020-03-23 11:49:35+00:00","nanti befday kamu, pakai duck so bila vivy yusof nampak dia pun berkata, check your dm" 
"2020-03-20 02:28:07+00:00","Kalau vivy buat crowdfun pun, dia tak minta kat ko la. Dia minta member member dia yg sama kaya dgn dia. Followers dia tu semua mewah mewah, kotak duck menggunung. Ko ilek aje." 
"2020-03-16 09:52:31+00:00","No need wait panic buying tonight kak. Tadi I stopped by Jaya Grocer near my apartment...mashallah!! The queue damn long macam Vivy Yusof baru release koleksi tudung DUCK terbaru " 
"2020-03-12 23:23:00+00:00","Ingtkn lpas vivy yusoff buat video org juai fake duck dia. Org dh stop juai. Ada lagi. Hmmm. Seriously aku yg tgk video dia pn dpt ksedaran kut psl jual fake, usaha business org smua. Copyright, and so on la." 
"2020-03-11 14:20:43+00:00","Just realized Vivy Yusof pattern promoting brands; duck, lilit, mel&amp;molly &amp; fizi woo (for the weekend) " 
"2020-03-10 02:17:45+00:00","Betul juga kan? Sbb dia scam ramai org pakai duck product. Maybe kite boleh mention vivy?" 
"2020-07-25 08:16:00+00:00","Kami gembira kerana Calmer® menolong beberapa orang menghidap tinnitus mereka. https://www.flareaudio.com/pages/calmer-life" 
"2020-03-08 16:33:19+00:00","True. Also duck punya edition pun semua dah nak sama. Pastu almost every week ada launch. and vivy suka design scarf with borders. While Naelofar pun dah revamp baru. So, makin nice yeaaaa" 
"2020-03-08 07:32:24+00:00","Jangan kasut Hikari tu dah macam level2 tudung duck vivy yusuf la. Power ni! " 
"2020-03-05 05:47:33+00:00","Boba dUck tuu look effingly tempting like rasa nak beli sbb Vivy look sooo pwettyyyyy and the concept is superrrr cute urghhhhh." 
"2020-03-05 03:46:54+00:00","taktahulahhhhh tapi memang tak ramai pakai dekat malaysia mula mula keluar kalau kau kenal vivy yang hq tudung duck tu guna" 
"2020-03-04 05:42:07+00:00","Duck square also looks good when vivy wears it. TAPI duck dah improve sikit diaorg punya square. Since collab dgn barbie. Bubbly square also senang bentuk. Apa2 pun. Jgn pakai ducknam. " 
"2020-03-03 09:24:21+00:00","vivy yang ini ya bukan vivy duck " 
"2020-03-03 02:23:12+00:00","Vivy Yusuf punya brand duck cosmetics okay ke?" 
"2020-03-03 01:45:12+00:00","Hi vivy yusoff duck tak nak buat sale kew " 
"2020-03-01 14:47:46+00:00","“Tak boleh ke kalau saya masuk duck tiba tiba vivy yusoff ada dlm tu?” Him : hahhhahahahhahaha..........takde Ah boys know nothing! Gelak je annoyingggg" 
"2020-02-28 13:01:11+00:00","tudung duck yang LE sumpah lawa2 kalau vivy pakai... cube sampai kat aku,..... buruk terus jadi that’s why the only LE i hv is Oops duck jeee tu pun baru 3 kali pakai eventho dah beli time f3 cs it looks ugly on me" 
"2020-02-27 05:01:26+00:00","ni fake duck (sorry vivy, saya beli sebab nak compare, i dah cabut tag duck kat tudung) " 
"2020-02-24 12:43:25+00:00","Lihat saja produk Duck keluaran usahawan terkemuka Malaysia iaitu Vivy Yusof telah pun terkenal meniti di bibir bibir seluruh rakyat dunia di setiap pelosok. Tidakkah kita berasa bangga melihat produk keluaran Malaysia begitu tinggi dipandang." 
"2020-02-23 10:34:00+00:00","I was randomly post our beloved queen of johor wearing a duck pleated and tag the duck group and me being me forget to tag vivy also so had to do the repost after excitedly got notification from duck group and now vivy noticed my post!!!! " 
"2020-02-21 09:33:45+00:00","so basically basyir is my sugar daddy now exc that he won't treat me a duck's scarf coz he said I'll be looking like vivy and he prefers me in neelofa's hijab style lol" 
"2020-02-20 15:55:12+00:00","salam kak vivy saya nak order duck kuning extra manik please " 
"2020-02-19 03:03:37+00:00","i've always thought duck scarves are too overrated until i finally own one vivy you did a gr8 job" 
"2020-02-16 15:55:56+00:00","Tadi after keluar dari kinokuniya, i was looking at my phone and we passed by duck store, then Faris nak attract my attention, dia cakap lah ada vivy yusof depan tu.. dia nak main2 je guys sekali betulllll hahhhaa aish!!! Dapat tgk anak2 dgn husband dia depan2 &amp; ofc la dia skli " 
"2020-02-14 12:33:36+00:00","*secretly wanted to meet vivy yesterday at dUck klcc but missed her instead*" 
"2020-02-12 17:25:38+00:00","Kenapa FV dah makin lama dah makin bosan sbb kerja promote brand yang sama je? Mesti Lilit, Mel & Molly, Duck or Poplook. FV dulu best sbb byk variety brand yg Vivy and FV promote. Sekarang ni brand yg sama je." 
"2020-02-08 11:04:02+00:00","Ada la. Duck, vivy tu wuwuwu" 
"2020-07-25 08:16:00+00:00","Kami gembira kerana Calmer® menolong beberapa orang menghidap tinnitus mereka. https://www.flareaudio.com/pages/calmer-life" 
"2020-02-08 09:06:33+00:00","Aku nak duck vivy yusof" 
"2020-02-08 05:25:07+00:00","Style lah vivy holiday sakan tak nampak plak beg duck dia pakai kecuali bag beli barang dapur tu agahahahah " 
"2020-02-06 13:40:34+00:00","Itik is Duck.. Duck is Vivy" 
"2020-02-06 13:03:50+00:00","Qis duck duck vivy. Jgn kacau neelofa please. I need sugar mummy " 
"2020-02-02 11:15:05+00:00","been watching vivy yusof's videos about duck scarves and i gotta say i'm quite tempted to buy some ducks now" 
"2020-02-02 08:57:23+00:00","Kenapa aku rse Vivy ni tak fokus kat business dia? Fashion Valet ni asyik brand tulerr je lpstu balik2 Duck. Rase nk delete je apps ni. Kecewa." 
"2020-02-02 08:08:48+00:00","Baru lepas tengok youtube vivy pasal fake ducks tu. Dia cakap makcik dia pun beli fake ducks. Makcik vivy yusof pun pandai beli tudung murah je. Yang tak pandai je beli tudung memahal " 
"2020-02-02 02:36:24+00:00","Kadang kan.. Memang betul pakai shawl ke square duck ni nampak macam WOW! Tp, yang pemakainya pun.. Senonoh la sikit pakainya. Biar la nampak mmg tudung tu mahal. Korang nak tiru cara vivy pakai tu susah le. Vivy tu, pakai plastik sampah hitam kat kepala pun nampak macam mahal.." 
"2020-02-01 15:25:42+00:00","vivy yusof molah video unboxing fake duck. kakya molah muka gelik2. so what? inggar. sa best ko ya" 
"2020-01-30 13:00:47+00:00","I saw my cousin (boy) follow duck group , cosmetic and ofcos vivy's ig . I asked him why , he told me that he can be someone that up to date about duck so he can buy for his gf if he have gf so good doe " 
"2020-01-29 15:57:05+00:00","Ceh VIVY YUSOF.. look here..aku tau kau marah bila ada org jual fake punya duck product especially scarf. Tapi cara kau react ya tohan aku rasa mau tumbuk ja. budu amat" 
"2020-01-28 02:38:49+00:00","Disney X Duck.. Seriously been following vivy's blog since her college life lagi. Never once teringin apa2 from duck sebab obviously mahal n xpakai shawl sgt.. Tp yg ni sbb mickey mouse ermmm.. Contemplating. Rm300 for a scarf but i wanttt. Haishh biasa tudung rm10 je sis ni" 
"2020-01-27 16:57:06+00:00","Vivy's makeup for disney duck is on point i tell ya" 
"2020-01-27 14:56:26+00:00","Cantiknya vivy dalam gambar duck baru " 
"2020-01-27 02:30:41+00:00","Walaupun vivy ni kadang-kadang buat benda yang kita annoy, unbox vietnam duck umpamanya.. tapi I cannot deny duck team memang something. Cantik okay disney collection yang baru ni. I keep on talking to myself.. duit tu boleh buat beli diapers anakkkk.. Jangaaannn " 
"2020-01-25 10:29:01+00:00","Take note this, vivy duck " 
"2020-01-25 07:26:21+00:00","Mcm Vivy sbb Duck" 
"2020-01-22 16:33:14+00:00","The Conscious Duck Wow so proud of you vivy " 
"2020-01-22 07:56:51+00:00","scrolled through the replies under vivy's "unboxing fake ducks" video and it just feels very very wrong that some people are actually mad at her for comparing fake ducks and the original ones" 
"2020-01-21 19:04:37+00:00","Baru tengok video vivy unboxing fake duck, lepas tu baca komen, then terbaca komen "beli tudung harga ribu riban tapi pakai nampak leher buat apa, baik beli tudung fake tapi pakai tutup aurat" emm apa salah harga tudung tu gais? Ak xpaham." 
"2020-07-25 08:16:00+00:00","Kami gembira kerana Calmer® menolong beberapa orang menghidap tinnitus mereka. https://www.flareaudio.com/pages/calmer-life" 
"2020-01-21 13:36:02+00:00","Terhibur nengok Mak Bae punye live walhal dia promote tudung je pun but she bagus, refrained from saying other "premium" brands but can see the pleat "lebih kurang sama" macam duck sbb baru tgk utiup vivy hari tu Walhal kedua, wayer tak pakai pon shawl pleated ni wehh " 
"2020-01-21 11:11:16+00:00","Hey guys aku baru habis tengok unboxing fake dUCks hshshssh yo the comments haih i donno how to feel when i read them. That part yg vivy sebut pasal solat pakai telekung fake tu aku paham je ape yg dia cuba sampaikan" 
"2020-01-21 10:49:20+00:00","@katique151 Unboxing Fake dUCks | Vivy Yusof https://youtu.be/4BkKd566Dbc via @YouTube" 
"2020-01-21 01:59:51+00:00","Unboxing Fake dUCks | Vivy Yusof " 
"2020-01-20 01:32:18+00:00","Kenapa aku tengok video vivy unboxing fake duck tu cringe teruk" 
"2020-01-19 13:47:42+00:00","Beli duck ja mesti mau battle vivy please laaa kasi keluar banyak2 tu tumbler gigit ni sdhlah landyard tdk dapat beli " 
"2020-01-19 13:37:14+00:00","Why do girls who don’t wear dUCk scarves like to make hate comments on Vivy Yusof, dUCk and girls who wear dUCk? Like chill woman no one is forcing you to buy dUCk." 
"2020-01-19 12:07:05+00:00","Shopping bag duck ni biashe biashe saje. Tapi boleh sold out. Power betul product vivy ni. #luckyigotforfree. #" 
"2020-01-18 01:57:22+00:00","SHE GOES BACK TO BEING A DUCK VIVY THE PRINCE AND RUE LIVE HAPPILY EVER AFTER AND THEN SHE’S JUST A DUCK AND FAKIR STAYS WITH HER BUT THEY CAN’T BE TOGETHER NOT REALLY " 
"2020-01-17 15:41:04+00:00","Kak Vivy ada buat event untuk recycle boxes of dUCk. Boxes aku taklah banyak ada dalam 70 je. Sayang nak recycle tapi mama cakap semak banyak2 #duckscarves #dUCkies" 
"2020-01-17 13:36:45+00:00","Me when watching vivy unboxing fake ducks woman i want your huge diamond rings" 
"2020-01-17 06:41:57+00:00","Tudung dUCK kena ciplak, Vivy Yusof luah perasaan sakit hati. Ikuti kami di: Instagram: @hijabnheelsofficial Facebook: @hijabnheels YouTube: @hijabnheels Twitter: @hijabnheels #hijabnheelsofficial #hijabnheels #cUCK #tudung https://www.hijabnheels.com/posts/tudung-duck-kena-ciplak-vivy-yusof-luah-perasaan-sakit-hati" 
"2020-01-17 04:06:26+00:00","duck if masuk pasaran china then yes, because the law over there mmg kena do animal testing. apa apa pun pls confirm kan dgn Vivy herself and call her out of her brands support animal testing cause honestly we can do better " 
"2020-01-17 00:50:28+00:00","@Sya_NurFi aku mmpi kau semalam. kita dua g event vivy yusof dpt duck scarf hahahah. kau okay tak tu?" 
"2020-01-16 10:54:00+00:00","satu jelah nak cakap, dUCk starter kit challenge for non hijabi ni serious tak terfikir dek akal... vivy and team tak pernah mengecewakan bab marketing. well done, guys!" 
"2020-01-16 05:00:53+00:00","First time la aku layan utube channel vivy yusof pasal unboxing fake Duck." 
"2020-01-15 16:23:36+00:00","just watch vivy's video comparing her ducks with the fake one and honestly that's was soooo unnecessary and annoying" 
"2020-01-15 16:00:31+00:00","Now, bagi pandangan aku as "orang yang mampu beli" Betul, Vivy created this dUCks for those yang mampu beli. Why? Because of the material yang dia buat. Design yang dia buat sendiri. of course mahal. And target audience dia mesti lain kan?" 
"2020-01-15 15:52:27+00:00","just watched vivy's vid about unboxing fake dUCks. Well i have 2 views rn." 
"2020-01-15 13:21:40+00:00","I confuse jap kenapa u sedih kotak duck kna buang. Im like, sis u founder duck kan?amik jela kt kilang kotak tu. Sorry i confused you and vivy yusof " 
"2020-07-25 08:16:00+00:00","Kami gembira kerana Calmer® menolong beberapa orang menghidap tinnitus mereka. https://www.flareaudio.com/pages/calmer-life" 
"2020-01-15 12:44:41+00:00","Aku dgn rumet lepas tgok video vivy pasal fake duck : Bayangkan kalau hotdog ada jenama duck yg fake , jadi nama hotduck alaahai eloklaa dua org ni" 
"2020-01-14 15:51:55+00:00","Unboxing Fake dUCks | Vivy Yusof " 
"2020-01-14 06:43:20+00:00","baru je tengok vivy punya reaction pasal fake n authentic duck tu.. ermm " 
"2020-01-14 05:19:20+00:00","Vivy unboxing fake dUCks kelakar part dia geli nk sarung tudung tu kat kepala dia " 
"2020-01-14 03:24:02+00:00","Not a fan of vivy. Tapiii rude betul datang rumah vivy pakai fake dUck lepastu siap bagitau dia. “I pun pakai tudung dUck tapi beli kat vietnam”. How rude. Hish cannot brain." 
"2020-01-14 03:13:32+00:00","What i learn from Vivy's latest vlog about the fake ducks is - Ya ofcourse we will feel so disappointed and angry when someone else copied our hardworks. But there's no need to take actions towards these people. Instead, just go forward and upwards to improve urself more. " 
"2020-01-14 00:59:53+00:00","Aku tengah tengok vivy reveal fake duck dari vietnam tu luluh weyy hati dia tgk " 
"2020-01-13 12:21:47+00:00","tudung kartel ni kualiti dia sama tak dengan kt gm klang tu. aku rasa semua tudung sama je. aku suka beli yg murah je. sebab aku tengok kualiti tudung duck pun, bila aku pakai, tak sama pun macam vivy yusuf." 
"2020-01-13 11:04:40+00:00","watched Vivy's video of fake dUcKs.. it breaks my heart. you ignorant people might say, alaaa rilekk laa dia dah kaya kot.. but the thing is, her team efforts, sweats and hustle are real and suddenly you simply copy." 
"2020-01-13 09:42:53+00:00","i watched Vivy's video pasal dia unboxing fake duCK scarves. Kesian pulak tengok respon Vivy eventhough dia tenang je bukak satu satu and compare the fake one and the original one." 
"2020-01-13 07:21:29+00:00","I dont hate vivy yusof but her new video, unboxing fake ducks like bro i get it its your hard work but shut up Balenciaga gets copied everywhere and they say nothing, you’re not on top of the world to complain any brand that you put out is at risk of being faked up so suck it" 
"2020-01-12 18:02:21+00:00","vivy was talking about fake duck and some dumb men in the replies said something about tudung murah better for aurat. correlation? tau bodoh tu free tapi jgn la borong semua" 
"2020-01-12 15:58:03+00:00","I baru lepas watch Vivy unboxing fake dUCK scarves and I can totally understand what she means. Say what you will about her scarves being too expensive, but to me, there really is a HUGE difference between her scarves and the fake ones." 
"2020-01-12 05:59:08+00:00","To those who buy fake dUck, watch this: Unboxing Fake dUCks | Vivy Yusof https://youtu.be/4BkKd566Dbc via @YouTube" 
"2020-01-12 05:18:37+00:00","Unboxing Fake dUCks | Vivy Yusof https://youtu.be/4BkKd566Dbc via @YouTube This video is really eye opener. I just want people to realize that it is bad to do the thing as buying fake products (u support criminals!) Even though I’m not a fan of duck but her point is there, yeahh" 
"2020-01-12 03:20:21+00:00","to bring the brand to a higher level (even they've reached it). Just be proud of duck because it's mean that duck is being known around the world till the Vietnamese copying duck's brand. Vivy have reached higher level. Vivy shouldn't be bother abt this. Just let the things out." 
