TweetDate,TweetText
"2020-03-30 19:50:11+00:00","Nasib I bukan perminat Duck. Pity you Vivy " 
"2020-03-30 18:30:00+00:00","Aku lagi ksian selama ni ak tak tahu jenama duck tu vivy punya HAHAHAHAHA. And tak berminat nak beli.. aku beli tudung dekat pasar malam awning jadi elok ja siap bole himpun banyak warna lagi tau sebab murah." 
"2020-03-30 18:28:26+00:00","sooo, i beli tudung duck sbb sales teroks. end up aku kena kecam sbb support kak vivy . gurls i just love the scarf material " 
"2020-03-30 17:57:55+00:00","Hye gais, if you gais tngah cari replacement for itik scarf, i boleh suggestkan. Btw, i beli scarf ni kat shopee jurr. Jangan risau harga dia RM15 ke bawah je, bukan ratus ratus pun. #JK #StayHome #StaySafe #COVID19 #B40 #duck #vivy " 
"2020-03-30 17:55:45+00:00","can we all agree to resell those duck scarves at the low price and boycott vivy ? " 
"2020-03-30 17:38:39+00:00","Sebagai Rakyat Malaysia Kita support local product Kita pun beli lah tudung Duck Vivy dah kaya dapat duit Vivy pula support international product Sekian." 
"2020-03-30 17:37:04+00:00","Patutlah no wonder FV dia meletopz nak mampos. Pastu tetibe dUck pun meletopz tetibe. Baru tau dia guna subsidiary company utk untungkan parent company. Hahsjdjdjs fak vivy" 
"2020-03-30 17:25:31+00:00","Rilek je vivy. Takyah cakap apa2 duduk diam je kat rumah. Orang kita ni bising dua tiga hari je besok lupa dah. Dah lama sikit nak dekat raya nanti buatlah sale besar besaran dUck. Confirm org beli balik. Ez" 
"2020-03-30 17:21:37+00:00","Duck vivy ke pergh kayo" 
"2020-03-30 17:11:51+00:00","Aku support vivy and i bought her products until recently, pasal kes semalam aku terus unfollow vivy dgn fv. Aku suka duckscarves especially mss. Ada org tahu any other brand yg material macam duck punya mss?" 
"2020-03-30 17:09:41+00:00","Baru aku tau brand duck ni vivy punya.. tq netizen" 
"2020-03-30 16:31:41+00:00","can someone tell me what happened about vivy and his duck stuffs , aku macam tertinggal je " 
"2020-03-30 16:29:30+00:00","Vivy tak vivy lah . Aku pun tak kenal dia tu siapa tahu tahu org panggil dia DUCK lagi aku jem Aduuuhh bibiucop ." 
"2020-03-30 16:17:32+00:00","why la vivy why. aiyo nak kena sorok logo duck ke cane ni " 
"2020-03-30 16:04:25+00:00","Vivy nihh pon ade duck " 
"2020-03-30 15:57:50+00:00","Vivy yang aku kenal ialah Princess vivy alabasta from one piece and dia pun ada dUck juga AHHAHAHAHAHAH " 
"2020-03-30 15:56:12+00:00","Mcm mana Vivy tak faham kenapa statement yg dia tulis tu salah, mcm tu lah aku tak faham korang yang pernah beratur beli duck scarf. Tudung takdelah lawa mana dengan overpriced lagi." 
"2020-07-25 08:16:00+00:00","Kami gembira kerana Calmer® menolong beberapa orang menghidap tinnitus mereka. https://www.flareaudio.com/pages/calmer-life" 
"2020-03-30 15:27:13+00:00","Kawan kawan aku semua yang beli duck dah let go duck duck dorg. Vivy you lost your customer trust" 
"2020-03-30 15:15:31+00:00","Yang tweet "Duck is Cancel" ni aku syak bukan keluar duit sendiri pun beli tudung vivy paling kurang boyfriend belikan takpun sugar daddy " 
"2020-03-30 15:10:35+00:00","Acah2 aja hampa ni bash vivy, nanti tudung duck baru launch kalut jugak beli, nasib baik la aku miskin dan muka tak sesuai dengan tudung duck.. bukan semua la yang acah2 tu" 
"2020-03-30 15:10:19+00:00","Siapa bagitahu laki aku vivy jual duck. Hm now dia suruh boikot " 
"2020-03-30 15:08:36+00:00","Tak minat vivy pon tp follow je sblm ni sbb dia famous kan. Tp dah unfollow dia dah lepas isu ni. Nasib mmg x support Duck. Ada 1 je la hadiah bday hari tu yg sorg lg tu mmg tak pernah tau sape. Haha " 
"2020-03-30 15:05:24+00:00","Aku follow vivy dari dulu sebab Daniel ja, tak laa nak taksub sangat beli itu ini. Setakat la duck ada laa satu, tu pun adik bagi hadiah birthday Lani dok tengok Sarah la sebab dia Daniel version gegirl " 
"2020-03-30 14:51:01+00:00","I dont know why, but i already hate vivy from the start. HAHHAHAHAHAHAHH!! Sebab tu orang sibuk beli duck helloo i sikit pun tak heran. I pakai bawal 5 ringgit je hokey. Shawl mahal sikit lah, 10 ringgit." 
"2020-03-30 14:50:31+00:00","Tu msti yg duk sanjung dia and pakai duck... no more respect for Vivy.... Sbgai alumni uitm, mnyesal uitm lantik dia bod uitm" 
"2020-03-30 14:48:41+00:00","duck duck vivy yeye" 
"2020-03-30 14:40:20+00:00","Hahaha bodoh ini terletak pada pembeli bukan penjual. Bkn nk back up vivy tapi begitulah cerdik dia plok rebranding semua brg and ltk cop duck. " 
"2020-03-30 14:40:01+00:00","And i really thot vivy ni inspired semua org tau but the fact dea ni riak sgt. Ritu saje je try lipstik duck tu...Bebiase je. Hrge dh nk same gn hrge lipstik2 dri korea." 
"2020-03-30 14:36:25+00:00","vivy tu memang layak kena kecam. tapi aku beli tudung duck sbb hmmm cantik elok terletak kat kepala aku &amp; sarah comel " 
"2020-03-30 14:05:25+00:00","Aku ada barang duCk tuu.. tapi orang yang bagi.. bukan aku beli sebab aku belum mampu.. tapi patut ke aku nak terasa bila vivy kena kecam? Hahahaha confused jap" 
"2020-03-30 14:04:55+00:00","niat aku nk bli duck hancur kecai dah lepas vivy buat statement gitu." 
"2020-03-30 13:54:55+00:00","Kite tak faham apa awak tulis. 10x baca x faham... kite x minat Vivy Yusof or her duck scarves. Kite beli baju kat Fashion Vallet je tu pon brand org lain " 
"2020-03-30 13:52:23+00:00","Vivy jual brand bukan jual produk. Kalau boleh satgi dia bukak kedai runcit tapi ber-brand kan duck. Beras duck, toothpaste duck etc.. " 
"2020-03-30 13:42:33+00:00","I don’t want to spread hatred but she also dah buat program apa ntah tu love Vivy and duck baru launch new bag,See her game. Seriously she just got cancel. Luckily tak terbeli her boba lipstick haritu. " 
"2020-03-30 13:27:48+00:00","nak boikot vivy/dUCk ?? nenek aku kata macam anjing menyalak bukit. tak igt lagi kes dato vida dgn aishah? cis" 
"2020-03-30 13:21:32+00:00","Tudung duck by vivy Yusuf" 
"2020-03-30 12:56:27+00:00","Vivy duck duck" 
"2020-07-25 08:16:00+00:00","Kami gembira kerana Calmer® menolong beberapa orang menghidap tinnitus mereka. https://www.flareaudio.com/pages/calmer-life" 
"2020-03-30 12:53:43+00:00","dUck yang vivy yusof ah" 
"2020-03-30 12:49:51+00:00","Lepas aku tengok vivy ni kondem orang yang tak mampu, aku dah taknak dah pakai tudung jenama Duck lagi. Aku boikot !" 
"2020-03-30 12:31:34+00:00","Saya ada dua tudung duck tapi tak bermaksud saya setuju dengan apa yang vivy cakap " 
"2020-03-30 12:31:14+00:00","Not a really fan of Vivy but this brother needs to know about branding. Dah brand dia kuat memang la dia letak 'Duck' dekat stapler harga boleh pegi sampai RM80. Cuba stapler tu letak brand 'Supreme', agak agak jadi RM80 ke RM800? Nonsense punya argument " 
"2020-03-30 12:27:31+00:00","Vivy Yusoff is too much..kalau bukan orang B40 yang menahan perut untuk nasi, tiadanya Duck dan Fashion Valet kau tu maju.." 
"2020-03-30 12:21:37+00:00","Semua paki benci vivy yusof skrng, tunggu nanti dia release dUck covid-19 edition, letak batu sikit, jual rm700, semua berebut.. bodoh semua" 
"2020-03-30 12:19:56+00:00","baru aku tahu vivy tu tokey duck hahahahha" 
"2020-03-30 12:19:09+00:00","Mohon Vivy Yusoff buat tudung khas Duck versi PPE. " 
"2020-03-30 12:14:31+00:00","Tak salah pun kalau ada sesiapa yang penah beli ke pakai ke. Target market Duck tu memang untuk orang orang yang mampu pun. Janganlah ambik kesempatan ni, sebab marahkan si Vivy, semua pembeli tudung Duck dia pun nak kena tempias. Apoooooo lahhhhhh " 
"2020-03-30 12:12:14+00:00","I bought dUck scarves before this bcs i love the material especially the pleated ones. Not because of Vivy." 
"2020-03-30 12:03:38+00:00","Konon boikot vivy tapi raye nnt semua melaram tudung duck jgk " 
"2020-03-30 11:52:02+00:00","Tak pernah beli tudung duck yang mahal tak masuk akal tu. Ada satu pun sebab org belikan hadiah kahwin haritu. Klu keluar duit aku sendiri beli barang vivy err sorry la" 
"2020-03-30 11:44:33+00:00","menyesal aku beli dUCk scarves. vivy bukan appreciate customer pun" 
"2020-03-30 11:43:05+00:00","korang pernah tak tengok video vivy unboxing fake ducks ? kalau korang pernah tengok korang tau la perangai dia cane. dok feel so cheap feel so cheap " 
"2020-03-30 11:37:08+00:00","Cerita kat Z psl issue Vivy, n ckp “I dah lama tak minat dia dah”. Z reply “Baguslah yang. Dia mmg tak patut diminati pun”. Sabo ajelah. Mesti selama ni dia simpan dlm hati je bila sis cerita psl Vivy &amp; sibuk nak beli dUck." 
"2020-03-30 11:34:08+00:00","i get that many are upset with vivy, but please don’t support counterfeit products or say you’ll buy fake ducks from vietnam. yang design tu bukan dia, but her team. just support other original brands." 
"2020-03-30 11:31:38+00:00","Vivy dgn duck aku xpelik..kalau vivy dgn pig baru pelik " 
"2020-03-30 11:18:26+00:00","this vivy girl can shut the duck up already" 
"2020-03-30 11:18:10+00:00","apa benda lah vivy tu, you ada lipstick dUCk kan? ha buang lah nanti i belikan you lipstick baru" omg abit just said that...... " 
"2020-03-30 11:14:24+00:00","One thing I realised selepas kes Vivy ni, yes I dulu memang sanggup beli dompet and bag dia sebab it’s DUCK, so after kes Vivy semalam I learned one thing “Beli barang ikut keperluan bukan ikut nafsu sebab nak beli brand.”" 
"2020-07-25 08:16:00+00:00","Kami gembira kerana Calmer® menolong beberapa orang menghidap tinnitus mereka. https://www.flareaudio.com/pages/calmer-life" 
"2020-03-30 11:10:53+00:00","client aku untuk project retail kalini duck tau duh perangai ah vivy ni. ni rasa nak tukar client ni takde mood terus nak buat project" 
"2020-03-30 11:03:20+00:00","Dulu aku selalu cakap kat member aku, aku nak jadi kaya sampai aku mampu beli tudung duck. Sorry Vivy, I’m done. Baik aku beli tudung pasar malam lagi bagus. " 
"2020-03-30 10:51:55+00:00","aku penat la gelak dengar makcik pakcik aku gaduh pasal tudung dUCK makcik aku HAHAHAHAHA BOLEH DIA SURUH JUAL SEMUA VIVY YUSOF PUNYA COLLECTION HAHAHAHAHAHAHAHA" 
"2020-03-30 10:48:49+00:00","ok nak boycott duck pasni hm vivy ni banyak makan de-duck agaknya " 
"2020-03-30 10:10:17+00:00","Nampak unprofessional si vivy ni, orang kecam terus block . Tudung duck u boleh buat kain lap tingkap " 
"2020-03-30 10:04:06+00:00","kelakar je budak budak duck ni kena block dengan vivy " 
"2020-03-30 09:55:06+00:00","Vivy tu jual duck yg mekap tu ka . Sumpah aq tktau" 
"2020-03-30 09:47:19+00:00","I actually always ada niat nak beli shelai tudung duck as self reward la konon sbb kerja bagai nak rak tapi always jugak niat tk jadi. Why? Time tu la ade benda viral pasal vivy ni. Betul lah, kalau life tu kelas atasan belum tentu minda ni kelas atasan. So, mmg mati dah niat tu" 
"2020-03-30 09:40:32+00:00","Baru tahu harga stapler yg dekat Fashionvalet tu sebenarnya RM1.30. Sampai dekat Vivy, letak logo Duck terus jadi RM80.00 Silap lah cari pasal time netizen ramai tengah free " 
"2020-03-30 09:38:19+00:00","List cancelled: 1. DUCK VIVY 2. NAELOFAR LOPA 3. Sape pompuan yg kecoh kene byr gaji staff tu? Nobody tu laa.. tak kenal sheols sapa Aleeya/Aleen 4. NABIL 5. BLACK 6. SHARNAAZ 7. TOMOK Lagi?" 
"2020-03-30 09:33:08+00:00","Harap Dr Ros boycott duck Boycott vivy Boycott fashionvalet" 
"2020-03-30 09:25:02+00:00","Harini baca plak psal vivy yusof , psal kerugian , psal duit pnb , ermm Aku xprnah ade tdung duck , tp prnah la beli 1 lipmatte nye , tp xtau kenapa , xtertarik dgn vivy . Dari dlu . Tgk mmber aku obses sgt dgb dia" 
"2020-03-30 09:00:27+00:00","Aku akan boycott Vivy, tapi kalau sesapa nak jual tudung duck murah. Bgtahu aku. Aku nak beli. Jgn dibakor. Hehehehhe " 
"2020-03-30 08:57:39+00:00","Kau ingat aku vivy duck ke? Nk cancel cancel" 
"2020-03-30 08:54:04+00:00","Girlfriend say nanti diharamkan beli tudung duck, bukan apa saya takut kebodohan Vivy Yusof tu dia mengalir dalam otak girlfriend saya nanti. Tacodd " 
"2020-03-30 08:53:34+00:00","Yang twit duck off ni yg xbeli duck pun so vivy safe " 
"2020-03-30 08:48:43+00:00","Tak reti niaga vivy duck ni. Bagi juta2 pun boleh rugi. Gila beb " 
"2020-03-30 08:18:43+00:00","Baru baca pasal vivy kat fb. Itupon adik ipar @farahhaniss yg tag. Told u, i’ll never buy duck again. Dasyatnya vivy " 
"2020-03-30 08:16:30+00:00","Hahaa duck vivy takde twitter laa " 
"2020-03-30 08:16:08+00:00","Lowkey agree on prev rt. Aleeya tu punya comment lagi hurtful. Tapi orang attack founder duck tu fuh dahsyat betul ya. Lagi teruk kena dari aleeya. Not saying that i am a fans of vivy. Biasa je suka tengok anak anak dia, thats all. And yes, her mistake was responding to that" 
"2020-03-30 08:01:41+00:00","Korang tahu boss aku suka Duck.habis dia tapau semua staff2 yg bash vivy " 
"2020-03-30 07:58:40+00:00","@YanaNoruldin ni kes vivy tu, nasib sis xpakai duck, kita pakai tudung pasar malam je, alhamdulilah masih cantik " 
"2020-03-30 07:55:47+00:00","Yes ! I'm never have collection Duck by Vivy Yusof. Entah laa sebab apa pun tak tau, i better choose Naelofar instead of " 
"2020-03-30 07:51:19+00:00","wait. that unfunny comedian defending Vivy Duck yeh. Birds.... Nay, crows flock together." 
"2020-03-30 07:44:18+00:00","vivy tak patut bersuara actually. selama ni golongan b40 perabih duit beli duck duck dia tu, tapi bila diorang susah?" 
"2020-03-30 07:38:43+00:00","tgh hangat isu vivy teringat ex housemate, a nurse. minat betul dengan vivy. makan sambil tonton youtube vivy, kotak duck bersusun canak siap tanya aku ‘eh kau asal tak minta keja kat fashion valet?’ " 
"2020-03-30 07:36:01+00:00","Vivy beli ayam balut dengan duck" 
"2020-03-30 07:26:09+00:00","Mulai sekarang aku fuck duck dan vivy. Barua betul guna tektik umno berniaga" 
"2020-03-30 07:23:47+00:00","Fashion Valet, Duck and anything associated to Vivy Yusof is cancelled for me. I will not invest my money in a person who becomes richer and arrogant. #pledge" 
"2020-03-30 07:16:15+00:00","i hate how manipulative vivy.... but i do love dUCk there's no other brand can compete their satin silk " 
"2020-03-30 07:09:45+00:00","Nasib baik aku bukan fans Vivy Yusof and dUck. Takde la rasa kecewa mana en? " 
"2020-03-30 07:09:45+00:00","You know what i mean Some of my friend older Really agung agungkan vivy Beli duck beli semua brand vivy Now terbukti yang aku betul VIVY perosak orang miskin" 
"2020-03-30 07:08:45+00:00","Duck is selling lifestyle not product. Pakai Duck fefeeling macam vivy gitu or belongs to sejenis dgn “Tribal members”. Haish, macam dlm kelas Marketing lah pulak hahaha" 
"2020-03-30 07:03:54+00:00","Hai u guys yg tgh cari satin shawl can try royale satin shawl by swanheritage Dijamin puas hati dgn harga yg berpatutan serta mampu milik,kualiti yang bagus,anti pekak,kain xterlalu licin,tak jarang..ape lg ciri² yg perempuan nk utk sesuatu tudung tu ? #vivy #duck " 
"2020-03-30 06:55:05+00:00","Idc, i always love Vivy. Pergi lantak to those evryone who hates her now. Nnti jgn beratur kalau FV/dUCk buat sales ok " 
"2020-03-30 06:51:37+00:00","acah sembang cancel vivy tapi duck buat sales menduyun membeli. eh ? hiks " 
"2020-03-30 06:49:48+00:00","Benefit jgk org kutuk vivy ni. Ada yg suggest brand lain yg katanyaa kualiti sama je dgn duck. Mari laa kita try. Selamatkn poket masing2 hahahaha" 
"2020-03-30 06:48:51+00:00","crazy more than 100k people are talking about vivy. ok if u guys know where can i get the same material like duck scarf (and also neat eyelash) pls tell me. i swear i’ll stop buying duck." 
"2020-03-30 06:42:36+00:00","But most of my friends are those yg agung agungkan vivy and i really dont understand why. Gila dgn duck tudung la cosmetics la. And i'm here like why her????" 
"2020-03-30 06:41:38+00:00","Viral pula si vivy yusuf ni.. nasib pernah beli sekali je tudung ori duck.. tu pun menyesal.. siapa nak ? aku jual preloved hahhaahhaha " 
"2020-07-25 08:16:00+00:00","Kami gembira kerana Calmer® menolong beberapa orang menghidap tinnitus mereka. https://www.flareaudio.com/pages/calmer-life" 
"2020-03-30 06:39:16+00:00","Ducks. Vivy Yusof" 
"2020-03-30 06:33:48+00:00","yup vivy is cancelled, say no tu duck and fashion valet so they will learn from that" 
"2020-03-30 06:30:33+00:00","Setelah mengikuti info semasa pasal vivy itu. Nak tanya asal tudung duck dia tu mahal sangat? Konpem masuk surga ea pakai tudung tu?" 
"2020-03-30 06:29:50+00:00","The same person who tweets “eat the rich” when vivy announces duck sale: " 
"2020-03-30 06:23:23+00:00","I once so admire to Vivy. I don’t know why. Maybe sebab duck dia? Maybe sebab dia buat duck so exclusive with price so exclusive? Maybe sebab aku terikut sangat trend? For sure bukan sebab FV dia." 
"2020-03-30 06:22:41+00:00","Haah, yang dia duk comment ig dgn vivy yusof tu. duck pun jangan beli utk awek kau mi." 
"2020-03-30 06:20:39+00:00","Report la ig vivy dengan duck hahah" 
"2020-03-30 06:16:42+00:00","i’m not a fan of vivy and her duck and i’m glad i never spend my money on her overpriced scarves " 
"2020-03-30 05:54:57+00:00","dari dulu lagi aku tak percaya dengan Vivy Yusuf ni. sebabtu aku tak pernah beli tudung DUCK dia. aku sanggup free hair lah woiiii!" 
"2020-03-30 05:47:52+00:00","What’s up vivy, how’s your duck today ?" 
"2020-03-30 05:37:43+00:00","I'm not surprised if people still support Vivy. I have a friend who LOVES dUCk and she was never empathetic or sensitive to other people's problems and sufferings. These kind of people only care about "me". Heh." 
"2020-03-30 05:32:01+00:00","Aku pun dari dulu tak minat vivy weh sbb aku rasa dia mcm riak sangat je semua benda nak tayang menyampah jugak aku hahaha tah mcm mana tahh org boleh minat dia siap beli tudung duck tu" 
"2020-03-30 05:29:56+00:00","korang cancel cancel Vivy kat sini buat apa. Twitter ni 1% je. Pergi la buat campaign whatsapp, fb, radio, tv, insta boikot Duck." 
"2020-03-30 05:28:31+00:00","Some ppl beli duck bukan sebab vivy pon the quality bro... but ok nvm bye duck " 
"2020-03-30 05:15:26+00:00","Yang patut kena hentam lebih ialah Miss Aleeya tu tapi kenapa macam Vivy lagi teruk kena am not her fan, tak minat tudung Duck pun but let's be fair to her at least in this case. " 
"2020-03-30 05:14:11+00:00","Aiyoookk. If still ada yang support dUCk products after apa si Vivy tu cakap and buat, memang hampa buta perut hsksgskshskshsjs and this is not the first time pun dia buat perangai busuk. " 
"2020-03-30 05:11:12+00:00","I’ve never bought any dUck scarves nor dUck cosmetics before simply because the price tag don’t add up to the CHEAP QUALITY they offer. I know most of you only bought them for the brand but, its good now that your eyes are finally seeing the truth of what a scam Vivy is. " 
"2020-03-30 05:08:19+00:00","Jangan kata nak follow, aleeya ni siapa pon aku tak kenal hahaha vivy ni pon aku kenal nama dia sebab dia owner duck je. Kalau tak mampuih dua2 ni aku takkan kenal sampai bila bila " 
"2020-03-30 04:54:21+00:00","Nasib tak penah beli duck huhuhuhuh tu sepasai lagi satu pasai lecturer suka tanya sapa "idol" dlm kls dulu and most of my classmates answered "vivy" lol so yall regret now is it" 
"2020-03-30 04:46:11+00:00","“Vivy is cancelled vivy is cancelled” tup tup esok esok kau juga update story ig dengan duck sana duck sini. Sembang serupa pantat" 
"2020-07-25 08:16:00+00:00","Kami gembira kerana Calmer® menolong beberapa orang menghidap tinnitus mereka. https://www.flareaudio.com/pages/calmer-life" 
"2020-03-30 04:39:39+00:00","I love duck material thus i buy them. If anyone sell same material w a cheaper price, i would buy that scarf. Before i wrote this, i asked myself, is it bcoz i want to defend vivy. Ermm i dont think so. I bashed her for previous issues on maternity, mc &amp; iman azman etc." 
"2020-03-30 04:33:03+00:00","Dgr ckp vivy tu, sah dapat duit tu jangan beli mewah2, jangan beli Duck pulak." 
"2020-03-30 04:30:35+00:00","Habis lah vivy. Lingkup lah duck lepasni. Boleh lah beli tudung tu nanti sebab ada sale clearance stocks ehek" 
"2020-03-30 04:28:08+00:00","Vivy and duck cancelled. Uninstall FV" 
"2020-03-30 04:27:36+00:00","Aku x knl pon sbnrnya vivy ni sape sumpah ckp. Aku x tau pon wujud tudung duck ni, dulu laa. Dah masuk uni ni baru aku tau. X berkenan ahh, pki tudung pon nmpk leher " 
"2020-03-30 04:20:01+00:00","Baru niat nak hadiahkan my mum punye birthday shawl duck duck vivy tu tapi lepas jadi lagu ni terpaksa halau la duck tu balik. Ape brand lain yg okay, anyone " 
"2020-03-30 04:18:17+00:00","Vivy oh Vivy. I among your thousands of Duck customers. As rakyat marhaen yg saving utk beli tudung you, sanggup tak shopping 3 bulan utk beli tudung you, dua kali tau I beli. Tapi mcm ni you pandang golongan marhaen mcm kami. Business is business, but where's your empathy" 
"2020-03-30 04:14:54+00:00","tak pernah ada collection duck by vivy yusof but yg aleeya zailan nih aku mmng dh lama follow dia kt ig sbb aku minat tngok kulit muka dia tpi bila dh jadi cmni aku dah belajar sesuatu, "MUKA CANTIK TAK SEMESTINYA BIJAK ! " " 
"2020-03-30 04:12:08+00:00","Apo panggil orang jeles? Bye lah Vivy. No more DuCK. Even copy ori gred AA sebab sis sus sas tak support." 
"2020-03-30 04:09:41+00:00","hmm dah plan nak belikan tudung duck for my mom birthday this year, tapi lepas tengok side vivy ni terus tak jadi" 
"2020-03-30 04:05:00+00:00","I'm fans of Vivy and Duck, and this really disappointed me.." 
"2020-03-30 03:45:02+00:00","Boring la story vivy dengan aleeya zailan ni. Takde langsung keyboard warriors nak backup dia like they are total damned, orang lain nak cakap pun setakat bahan hari ni minta maaf esok beli la tu tudung duck, haih" 
"2020-03-30 03:28:18+00:00","I act baru je tahu siapa Vivy tu after her ducks collection gettin famous . So dr situ baru i kenal . But tk pernah dgr rumour abt her bfr srsly . Maybe I don't really care . But bila dh jd mcm ni , baru i know bfr this dia mmg ada buat hal ." 
"2020-03-30 03:28:07+00:00","Unfollow Vivy, duckgroup, duck cosmetics and uninstall fashion valet" 
"2020-03-30 03:27:12+00:00","Duck nk bukak dah ioi mall .. FV dah ade.. duck menyusul.. vivy ni mana penah hidup susah kot.. org senang" 
"2020-03-30 03:25:42+00:00","umi kata takmau beli duck dah lepaih ni sebab vivy kata camtu, dia perli aku gais sebab aku tak pernah beli duck kt dia," 
"2020-03-30 03:21:28+00:00","Naim dah baca kes vivy Yusof. Pagi2 buta aku pulak kena ceramah dgn dia sbb semua koleksi DUck. Sorry vivy lepas ni I xdapat support u lagi hahahahahaha" 
"2020-03-30 03:17:43+00:00","Whats with vivy tho. Tak pernah follow and tak pernah beli barang dia. Duck do have a quite selection of lipstick and i love lipstick. But i dont really want to own it. Mahal nakharam guys. Colorpop murah lagi hahahah" 
"2020-03-30 03:12:07+00:00","Gelabah tetek la vivy, takut orang tak beli duck ke ? Dont worry okay, rakyat malaysia ni pemaaf orangnya " 
"2020-03-30 03:09:28+00:00","ViVY ni jual tudung Duck ke Suck bukan apa ramai sangat dok menjilat " 
"2020-07-25 08:16:00+00:00","Kami gembira kerana Calmer® menolong beberapa orang menghidap tinnitus mereka. https://www.flareaudio.com/pages/calmer-life" 
"2020-03-30 03:03:03+00:00","Aku baru tau Vivy ni founder of benda lah duck tu. Aleeya ni lagi aku xkenal siapa. Avenys pun aku xtau benda apa. That’s how ignorant i am lol" 
"2020-03-30 02:58:24+00:00","oh tak habis lagi pasal vivy hahahah aku mmg tak berkenan dia tu hahahaha lagi satu duck dia lagi tak pernah beli even ad duit lebih pun fikir 10 kali nak beli hahahhaa" 
"2020-03-30 02:52:25+00:00","Mst vivy jual duck b40 pastok" 
"2020-03-30 02:51:37+00:00","Diaorg be like "lepasni confirm vivy buat sale besar. Save duit beli ducks after covid19" 
"2020-03-30 02:44:55+00:00","Ramai je sebenarnya peminat setia brand Duck ni. Majoriti yg dari golongan elit. Sebab tu Vivy Yusof bukan kisah pon kalau ramai netizen nak kecam atau boikot produk dia. Dia dah ada target customer yg tetap" 
"2020-03-30 02:44:30+00:00","Rt if korang nak your loved ones hadiahkan mana la tahu ada secret admire nak bagi kan This matte satin ni of course affordable la instead of tudung duck vivy yang ribu riban tu 3rd April this shawls restock so apelagi grab them all tau do pm me at 0102630368 right now or " 
"2020-03-30 02:42:49+00:00","Kenapa org benci vivy yusof? Kenapa org boikot duck? Aduh, tertinggal boat dah ni" 
"2020-03-30 02:40:54+00:00","Baru aku tahu duck tu vivy yg punya.... Igt kn overseas punya brand..." 
"2020-03-30 02:38:01+00:00","Korang ni tak abis2 cancel Duck since before , but the moment Vivy release new scarves - yall buy them and suddenly she's relevant again." 
"2020-03-30 02:19:18+00:00","Me too. Tudung Duck by vivy Yusof pun x da. Apa lgi Aleeys Zainal.. " 
"2020-03-30 02:14:31+00:00","Alah. Pung pang pung pang marahkan vivy nanti duck buat sale hakak-hakakkk ni jugak beratur beli. LoL #aptb #vivy #vivyyusof #COVID19 #COVID19malaysia" 
"2020-03-30 02:07:39+00:00","Vivy Yusof. No matter how many times she created shit but all these peoples would still buy her dUCk scarves. Just wait and see when this RMO is over soon and people who bashed her will forget about this and her sales will still be high as sky " 
"2020-03-30 02:01:35+00:00","pasal apa ni babe? kenapa dgn duck &amp; vivy yusof ?" 
"2020-03-30 01:59:00+00:00","Aku mmg tak pernah minat dgn vivy ni. Lg2 tgk video dia unboxing tudung duck fake dan compare dgn yg ori punya. Tak salah pun dia buat tu tp annoying gila tgk cara dia. Sekali dgn staff dia poyo acah2 aduhhh" 
"2020-03-30 01:51:17+00:00","Kuarantin hari ke 13. Sekejap sahaja kita akan kutuk Vivy, Black, Tomok serta Tajul. Nanti bila dia keluarkan tudung duck baru, lagu baru, korang juga sanggup beratur panjang dekat store Vivy dan nyanyi lagu artis cakap lagu mereka kena dengan time korang putus cinta. Haklahh." 
"2020-03-30 01:29:26+00:00","Tak payah lah menangguk di air yang keruh demi secebis likes dan retweet brader. Vivy pun tak claim duck tu SME, dia just bagi pendapat tentang pakej ransangan kerajaan" 
